CARTAO;PRODUTOR;MATRICULA;RAMO;APOLICE;DT_ADMISSAO;DT_VIGENCIA;CPF_TITULAR;NOME_BENEFICIARIO;DT_NASCIMENTO;RG;RG_ORGAO_EXP;RG_UF;SEXO;NOME_MAE;DDD1;FONE1;RAMAL1;DDD2;FONE2;RAMAL2;DDD_CEL;FONE_CEL;EMAIL;NOME_RESP_LEGAL;CPF_RESP_LEGAL;RG_RESP_LEGAL;DT_NASC_RESP_LEGAL;SEXO_RESP_LEGAL;PARENTESCO_RESP_LEGAL;CEP;LOGRADOURO;NUMERO;COMPLEMENTO;BAIRRO;CIDADE;UF;TIPO;CLIENTE
;PROD PJ;PROT002338;VG;42786;01/05/2017;01/05/2017;084.841.167-60;RENE COELHO DOS SANTOS;01/06/1981;;;;M;;21;37225084; ;;;;;;francisco.goncalves@protel.com.br;;;;;;;22790-703;AVENIDA DAS AMÉRICAS;19005  ;;RECREIO DOS BANDEIRANTES;RIO DE JANEIRO;RJ;;CONDOMINIO ABSOLUTTO BUSINESS TOWERS  
;PROD PJ;PROT002340;VG;42786;01/05/2017;01/05/2017;091.515.617-27;FABIO DE SOUZA DIAS;12/01/1980;;;;M;;21;37225084; ;;;;;;francisco.goncalves@protel.com.br;;;;;;;22790-703;AVENIDA DAS AMÉRICAS;19005  ;;RECREIO DOS BANDEIRANTES;RIO DE JANEIRO;RJ;;CONDOMINIO ABSOLUTTO BUSINESS TOWERS  
;PROD PJ;PROT002373;VG;42786;01/05/2017;01/05/2017;025.728.217-37;CRISTIANO DOS SANTOS BEZERRA;13/02/1975;;;;M;;21;37225084; ;;;;;;francisco.goncalves@protel.com.br;;;;;;;22790-703;AVENIDA DAS AMÉRICAS;19005  ;;RECREIO DOS BANDEIRANTES;RIO DE JANEIRO;RJ;;CONDOMINIO ABSOLUTTO BUSINESS TOWERS  
;PROD PJ;PROT002374;VG;42786;01/05/2017;01/05/2017;113.356.847-51;LUIS RICARDO DOS SANTOS SILVA;08/03/1984;;;;M;;21;37225084; ;;;;;;francisco.goncalves@protel.com.br;;;;;;;22790-703;AVENIDA DAS AMÉRICAS;19005  ;;RECREIO DOS BANDEIRANTES;RIO DE JANEIRO;RJ;;CONDOMINIO ABSOLUTTO BUSINESS TOWERS  
;PROD PJ;PROT002375;VG;42786;01/05/2017;01/05/2017;145.434.327-38;RODRIGO DA VEIGA NETTO;05/07/1990;;;;M;;21;37225084; ;;;;;;francisco.goncalves@protel.com.br;;;;;;;22790-703;AVENIDA DAS AMÉRICAS;19005  ;;RECREIO DOS BANDEIRANTES;RIO DE JANEIRO;RJ;;CONDOMINIO ABSOLUTTO BUSINESS TOWERS  
;PROD PJ;PROT002376;VG;42786;01/05/2017;01/05/2017;087.581.327-59;CRISTIANE MENDES DOS SANTOS;24/11/1980;;;;F;;21;37225084; ;;;;;;francisco.goncalves@protel.com.br;;;;;;;22790-703;AVENIDA DAS AMÉRICAS;19005  ;;RECREIO DOS BANDEIRANTES;RIO DE JANEIRO;RJ;;CONDOMINIO ABSOLUTTO BUSINESS TOWERS  
;PROD PJ;PROT002377;VG;42786;01/05/2017;01/05/2017;042.648.077-51;ANTONIO CARLOS CRISTIANO ARAUJO;09/02/1973;;;;M;;21;37225084; ;;;;;;francisco.goncalves@protel.com.br;;;;;;;22790-703;AVENIDA DAS AMÉRICAS;19005  ;;RECREIO DOS BANDEIRANTES;RIO DE JANEIRO;RJ;;CONDOMINIO ABSOLUTTO BUSINESS TOWERS  
;PROD PJ;PROT002378;VG;42786;01/05/2017;01/05/2017;123.062.217-90;THAIANA SANT ANNA DEONISIO;28/03/1994;;;;F;;21;37225084; ;;;;;;francisco.goncalves@protel.com.br;;;;;;;22790-703;AVENIDA DAS AMÉRICAS;19005  ;;RECREIO DOS BANDEIRANTES;RIO DE JANEIRO;RJ;;CONDOMINIO ABSOLUTTO BUSINESS TOWERS  
;PROD PJ;PROT002379;VG;42786;01/05/2017;01/05/2017;116.317.527-74;PRISCILA HELENA RODRIGUES ROSA;27/10/1985;;;;F;;21;37225084; ;;;;;;francisco.goncalves@protel.com.br;;;;;;;22790-703;AVENIDA DAS AMÉRICAS;19005  ;;RECREIO DOS BANDEIRANTES;RIO DE JANEIRO;RJ;;CONDOMINIO ABSOLUTTO BUSINESS TOWERS  
